"io_acronym","io_city_hq","io_country_hq","io_founded","io_id","io_name","io_type_I","io_type_II","io_type_III","io_yearbook_url"
"International IDEA","Stockholm","Sweden","1995","E2404","International Institute for Democracy and Electoral Assistance","E","gj","Institutes","http://ybio.brillonline.com/s/or/en/1100018274"
"IRRI","Los Baños","Philippines","1960","E2417","International Rice Research Institute","E","gyj","Institutes","http://ybio.brillonline.com/s/or/en/1100010642"
"CAHMIN","","","NA","E2509","Ad Hoc Committee for the Protection of National Minorities","U","gd","#XS1600003074","http://ybio.brillonline.com/s/or/en/1100055681"
"EFTA MPS","Brussels","Belgium","1992","E2527","Committee of Members of Parliament of the EFTA States Party to the EEA","E","g","#XS1600003074","http://ybio.brillonline.com/s/or/en/1100025874"
"EUFORGEN","Maccarese","Italy","1994","E2561","European Forest Genetic Resources Programme","E","g","#XS1600003074","http://ybio.brillonline.com/s/or/en/1100038434"
"ECPGR","Maccarese","Italy","1980","E2562","European Cooperative Programme for Plant Genetic Resources","E","g","#XS1600003074","http://ybio.brillonline.com/s/or/en/1100040653"
"","","","1975","E2598","Community Patent Interim Committee","H","gd","European Union Bodies","http://ybio.brillonline.com/s/or/en/1100005239"
"CGAP","Washington DC","USA","1995","E2606","Consultative Group to Assist the Poorest","E","gy","International Federations","http://ybio.brillonline.com/s/or/en/1100058398"
"ITC","Geneva","Switzerland","1964","E2639","International Trade Centre","E","g","United Nations Bodies","http://ybio.brillonline.com/s/or/en/1100034794"
"CCMS","","","1969","E2642","NATO Committee on the Challenges of Modern Society","U","gd","NATO Bodies","http://ybio.brillonline.com/s/or/en/1100022202"
"CONSSO","","","NA","E2712","Committee of North Sea Senior Officials","U","gd","#XS1600003074","http://ybio.brillonline.com/s/or/en/1100050764"
"","","","NA","E2734","JUSSCANNZ Group","H","gx","#XS1600003074","http://ybio.brillonline.com/s/or/en/1100014485"
"","Brussels","Belgium","NA","E2744","Energy Charter","E","gy","European Union Bodies","http://ybio.brillonline.com/s/or/en/1100038654"
"HCNM","The Hague","Netherlands","1992","E2753","OSCE High Commissioner on National Minorities","E","g","#XS1600003074","http://ybio.brillonline.com/s/or/en/1100067896"
"CTD","","","1985","E2890","Centre for Telecommunications Development","U","dg","#XS1600003074","http://ybio.brillonline.com/s/or/en/1100028777"
"UNHCR","Geneva","Switzerland","1951","E3016","United Nations High Commissioner for Refugees","E","g","United Nations Bodies","http://ybio.brillonline.com/s/or/en/1100018825"
"CC","Brussels","Belgium","1961","E3027","EFTA Consultative Committee","E","g","#XS1600003074","http://ybio.brillonline.com/s/or/en/1100015571"
"OSCE/ODIHR","Warsaw","Poland","1990","E3042","OSCE - Office for Democratic Institutions and Human Rights","E","g","Human Rights Organizations","http://ybio.brillonline.com/s/or/en/1100044455"
"WHC","Paris","France","1972","E3055","World Heritage Centre","E","g","UNESCO Bodies","http://ybio.brillonline.com/s/or/en/1100053634"
"","Geneva","Switzerland","1989","E3058","Telecommunication Development Bureau","E","gy","International Federations","http://ybio.brillonline.com/s/or/en/1100035676"
"","","","1968","E3064","Intergovernmental Group on Wine and Vine Products","H","gd","FAO Bodies","http://ybio.brillonline.com/s/or/en/1100005278"
"","Rome","Italy","1955","E3066","Intergovernmental Group on Rice","E","g","FAO Bodies","http://ybio.brillonline.com/s/or/en/1100018920"
"CSD","New York NY","USA","1993","E3104","United Nations Commission on Sustainable Development","E","g","United Nations Bodies","http://ybio.brillonline.com/s/or/en/1100043826"
"CSTD","Geneva","Switzerland","1992","E3120","United Nations Commission on Science and Technology for Development","E","g","United Nations Bodies","http://ybio.brillonline.com/s/or/en/1100007052"
"CCPCJ","Vienna","Austria","1992","E3128","United Nations Commission on Crime Prevention and Criminal Justice","E","g","United Nations Bodies","http://ybio.brillonline.com/s/or/en/1100025695"
"","","","1984","E3131","Australia Group","E","gc","Conference Series","http://ybio.brillonline.com/s/or/en/1100041944"
"","Maccarese","Italy","1974","E3150","Bioversity International","E","g","Institutes","http://ybio.brillonline.com/s/or/en/1100051730"
"WCCD","","","1992","E3214","World Commission on Culture and Development","H","gd","UNESCO Bodies","http://ybio.brillonline.com/s/or/en/1100063562"
"","Geneva","Switzerland","1990","E3241","Committee on Sustainable Energy","E","g","#XS1600003074","http://ybio.brillonline.com/s/or/en/1100029850"
"","Geneva","Switzerland","1994","E3246","Committee on Environmental Policy","E","g","#XS1600003074","http://ybio.brillonline.com/s/or/en/1100058196"
"","Geneva","Switzerland","1947","E3247","Committee on Housing and Land Management","E","g","#XS1600003074","http://ybio.brillonline.com/s/or/en/1100009414"
"TC","Geneva","Switzerland","1947","E3248","UNECE Timber Committee","E","g","#XS1600003074","http://ybio.brillonline.com/s/or/en/1100016114"
"","Strasbourg","France","1982","E3253","Standing Committee to the Bern Convention on the Conservation of European Wildlife and Natural Habitats","E","gy","International Federations","http://ybio.brillonline.com/s/or/en/1100057597"
"ECOSOC","New York NY","USA","1945","E3377","United Nations Economic and Social Council","E","g","United Nations Bodies","http://ybio.brillonline.com/s/or/en/1100027514"
"UNCTAD","Geneva","Switzerland","1964","E3381","United Nations Conference on Trade and Development","E","g","United Nations Bodies","http://ybio.brillonline.com/s/or/en/1100058717"
"UNDP","New York NY","USA","1965","E3382","United Nations Development Programme","E","g","United Nations Bodies","http://ybio.brillonline.com/s/or/en/1100015730"
"UNIDO","Vienna","Austria","1967","E3386","United Nations Industrial Development Organization","B","g","United Nations Bodies","http://ybio.brillonline.com/s/or/en/1100061471"
"UNITAR","Geneva","Switzerland","1963","E3387","United Nations Institute for Training and Research","E","gj","United Nations Bodies","http://ybio.brillonline.com/s/or/en/1100037897"
"EADRCC","Brussels","Belgium","1998","E3461","Euro-Atlantic Disaster Response Coordination Centre","E","g","NATO Bodies","http://ybio.brillonline.com/s/or/en/1100038688"
"","Santiago","Chile","1983","E3480","Center for Information on Migration in Latin America","E","g","#XS1600003074","http://ybio.brillonline.com/s/or/en/1100030877"
"Secretariat of the UNCCD","Bonn","Germany","1999","E3486","Secretariat of the United Nations Convention to Combat Desertification","E","g","United Nations Bodies","http://ybio.brillonline.com/s/or/en/1100046997"
"UNICs","New York NY","USA","NA","E3516","United Nations Information Centres","E","g","United Nations Bodies","http://ybio.brillonline.com/s/or/en/1100039771"
"WFP","Rome","Italy","1961","E3543","World Food Programme","F","g","United Nations Bodies","http://ybio.brillonline.com/s/or/en/1100053307"
"IARC","Lyon","France","1965","E3549","International Agency for Research on Cancer","E","g","European Union Bodies","http://ybio.brillonline.com/s/or/en/1100041708"
"SCBD","Montréal QC","Canada","1993","E3586","Secretariat of the Convention on Biological Diversity","E","g","Treaties","http://ybio.brillonline.com/s/or/en/1100005783"
"","Sarajevo","Bosnia-Herzegovina","1995","E3596","Peace Implementation Council","E","gy","International Federations","http://ybio.brillonline.com/s/or/en/1100063909"
"","Bonn","Germany","NA","E3603","Permanent Secretariat to the Agreement on the Conservation of African-Eurasian Migratory Waterbirds","E","g","Treaties","http://ybio.brillonline.com/s/or/en/1100029170"
"UIS","Montréal QC","Canada","1999","E3686","UNESCO Institute for Statistics","E","gj","Institutes","http://ybio.brillonline.com/s/or/en/1100020997"
"","Bonn","Germany","1995","E3687","UNEP/EUROBATS Secretariat","E","g","#XS1600003074","http://ybio.brillonline.com/s/or/en/1100025450"
"ZC","Vienna","Austria","1971","E3729","Zangger Committee","E","g","#XS1600003074","http://ybio.brillonline.com/s/or/en/1100031298"
"ICMPD","Vienna","Austria","1993","E3768","International Centre for Migration Policy Development","E","g","#XS1600003074","http://ybio.brillonline.com/s/or/en/1100006327"
"ENPG","","","1995","E3780","European Networking Policy Group","U","gyd","International Federations","http://ybio.brillonline.com/s/or/en/1100063605"
"IHRA","Berlin","Germany","1998","E3844","International Holocaust Remembrance Alliance","E","g","#XS1600003074","http://ybio.brillonline.com/s/or/en/1100031927"
"OIF","Paris","France","1997","E3879","Organisation internationale de la Francophonie","E","g","Human Rights Organizations","http://ybio.brillonline.com/s/or/en/1100039412"
"ECSR","Strasbourg","France","NA","E3916","European Committee of Social Rights","E","g","Human Rights Organizations","http://ybio.brillonline.com/s/or/en/1100042797"
"CCTT","Moscow","Russia","1993","E3939","Coordinating Council on Trans-Siberian Transportation","E","g","#XS1600003074","http://ybio.brillonline.com/s/or/en/1100015355"
"","","","NA","E4007","Regional Committee of the Convention on the Recognition of Studies, Diplomas and Degrees concerning Higher Education in the States belonging to the Europe Region","H","gd","UNESCO Bodies","http://ybio.brillonline.com/s/or/en/1100015827"
"ECMWF","Reading","UK","1975","E4022","European Centre for Medium-Range Weather Forecasts","E","g","#XS1600003074","http://ybio.brillonline.com/s/or/en/1100033331"
"ICRISAT","Andhra Pradesh","India","1972","E4115","International Crops Research Institute for the Semi-Arid Tropics","E","gj","Institutes","http://ybio.brillonline.com/s/or/en/1100026536"
"Interim Mekong Committee","","","1978","E4160","Interim Committee for Coordination of Investigations of the Lower Mekong Basin","H","gd","#XS1600003074","http://ybio.brillonline.com/s/or/en/1100050660"
"UNECE","Geneva","Switzerland","1947","E4176","United Nations Economic Commission for Europe","E","g","United Nations Bodies","http://ybio.brillonline.com/s/or/en/1100057032"
"IAWG-FIVIMS","","","1997","E4196","Inter-Agency Working Group on Food Insecurity and Vulnerability Information and Mapping Systems","U","gyd","International Federations","http://ybio.brillonline.com/s/or/en/1100040538"
"WWAP","Paris","France","NA","E4317","World Water Assessment Programme","E","g","#XS1600003074","http://ybio.brillonline.com/s/or/en/1100030375"
"MAB","Paris","France","1971","E4356","Programme on Man and the Biosphere","F","g","UNESCO Bodies","http://ybio.brillonline.com/s/or/en/1100063173"
"","Brussels","Belgium","2000","E4365","Youth in Action Programme","E","g","Human Rights Organizations","http://ybio.brillonline.com/s/or/en/1100031405"
"","Paris","France","1975","E4387","ISSN International Centre","E","g","#XS1600003074","http://ybio.brillonline.com/s/or/en/1100054607"
"","Strasbourg","France","NA","E4422","Group of States Against Corruption","E","g","#XS1600003074","http://ybio.brillonline.com/s/or/en/1100035621"
"DCAF","Geneva","Switzerland","2000","E4425","Geneva Centre for the Democratic Control of Armed Forces","E","g","#XS1600003074","http://ybio.brillonline.com/s/or/en/1100013521"
"IJSG","Dhaka","Bangladesh","2002","E4444","International Jute Study Group","E","g","#XS1600003074","http://ybio.brillonline.com/s/or/en/1100035644"
"","Geneva","Switzerland","NA","E4513","Secretariat of the Stockholm Convention on Persistent Organic Pollutants","E","g","Treaties","http://ybio.brillonline.com/s/or/en/1100063230"
"ESS","Lund","Sweden","1993","E4582","European Spallation Source","E","NA","NA","http://ybio.brillonline.com/s/or/en/1100033809"
"","Paris","France","1978","E5009","Intergovernmental Committee for Promoting the Return of Cultural Property to its Countries of Origin or its Restitution in case of Illicit Appropriation","E","g","#XS1600003074","http://ybio.brillonline.com/s/or/en/1100036238"
"IEA","Paris","France","1974","E5314","International Energy Agency","E","g","#XS1600003074","http://ybio.brillonline.com/s/or/en/1100010487"
"CES","Geneva","Switzerland","1953","E5349","Conference of European Statisticians","E","g","#XS1600003074","http://ybio.brillonline.com/s/or/en/1100066591"
"","Geneva","Switzerland","1959","E5486","International Occupation Safety and Health Knowledge Network","E","gy","ILO Bodies","http://ybio.brillonline.com/s/or/en/1100009504"
"PEEM","","","1981","E5924","Joint WHO/FAO/UNEP/UNCHS Panel of Experts on Environmental Management for Vector Control","U","gx","FAO Bodies","http://ybio.brillonline.com/s/or/en/1100023961"
"BRE","","","1973","E5937","Bureau de rapprochement des entreprises","U","gd","European Union Bodies","http://ybio.brillonline.com/s/or/en/1100001510"
"CEDAW","Geneva","Switzerland","1982","E6009","Committee on the Elimination of Discrimination against Women","E","g","United Nations Bodies","http://ybio.brillonline.com/s/or/en/1100035894"
"CAT","Geneva","Switzerland","1987","E6050","Committee Against Torture","E","gv","United Nations Bodies","http://ybio.brillonline.com/s/or/en/1100010334"
"CDMG","","","1979","E6097","European Committee on Migration","U","gd","#XS1600003074","http://ybio.brillonline.com/s/or/en/1100040507"
"EFC","Geneva","Switzerland","1947","E6120","European Forestry Commission","E","g","FAO Bodies","http://ybio.brillonline.com/s/or/en/1100010078"
"European Centre","Vienna","Austria","1974","E6139","European Centre for Social Welfare Policy and Research","E","g","United Nations Bodies","http://ybio.brillonline.com/s/or/en/1100045674"
"UNCITRAL","Vienna","Austria","1966","E6309","United Nations Commission on International Trade Law","E","g","United Nations Bodies","http://ybio.brillonline.com/s/or/en/1100018131"
"CD","Geneva","Switzerland","1978","E6548","Conference on Disarmament","F","g","United Nations Bodies","http://ybio.brillonline.com/s/or/en/1100064799"
"INPADOC","","","1972","E6551","International Patent Documentation Centre","U","dg","#XS1600003074","http://ybio.brillonline.com/s/or/en/1100001002"
"","Frascati","Italy","1966","E6746","ESRIN","E","gj","Institutes","http://ybio.brillonline.com/s/or/en/1100008276"
"","","","1966","E6892","European Health Committee","H","gd","#XS1600003074","http://ybio.brillonline.com/s/or/en/1100067204"
"FERT","","","1973","E6939","FAO Commission on Fertilizers","H","gd","FAO Bodies","http://ybio.brillonline.com/s/or/en/1100040397"
"CGRFA","Rome","Italy","1983","E6950","Commission on Genetic Resources for Food and Agriculture","E","g","FAO Bodies","http://ybio.brillonline.com/s/or/en/1100003086"
"","","","1967","E7015","Naturopa Network","H","gd","#XS1600003074","http://ybio.brillonline.com/s/or/en/1100060105"
"","Strasbourg","France","1964","E7159","European Pharmacopoeia Commission","E","g","#XS1600003074","http://ybio.brillonline.com/s/or/en/1100026669"
"IBSC","York","UK","1966","E7323","International Bird Strike Committee","E","g","#XS1600003074","http://ybio.brillonline.com/s/or/en/1100005110"
"ESTEC","Noordwijk","Netherlands","1967","E7353","European Space Research and Technology Centre","E","g","#XS1600003074","http://ybio.brillonline.com/s/or/en/1100057902"
"ESOC","Darmstadt","Germany","1967","E7412","European Space Operations Centre","E","g","#XS1600003074","http://ybio.brillonline.com/s/or/en/1100007198"
"","Issy-les-Moulineaux","France","1962","E7985","OECD Development Centre","E","g","#XS1600003074","http://ybio.brillonline.com/s/or/en/1100011211"
"Development Committee","Washington DC","USA","1974","E8201","Joint Ministerial Committee of the Boards of Governors of the World Bank and the International Monetary Fund on the Transfer of Real Resources to Developing Countries","E","g","#XS1600003057#XS1600003074","http://ybio.brillonline.com/s/or/en/1100067437"
"IMFC","Washington DC","USA","1974","E8249","International Monetary and Financial Committee","E","g","#XS1600003074","http://ybio.brillonline.com/s/or/en/1100022853"
"DAC","Paris","France","1961","E8251","OECD Development Assistance Committee","K","gy","International Federations","http://ybio.brillonline.com/s/or/en/1100045232"
"CITES Secretariat","Geneva","Switzerland","NA","E8554","Secretariat of the Convention on International Trade in Endangered Species of Wild Fauna and Flora","E","g","Treaties","http://ybio.brillonline.com/s/or/en/1100037476"
"CAC","Rome","Italy","1962","E8700","Codex Alimentarius Commission","E","g","FAO Bodies","http://ybio.brillonline.com/s/or/en/1100053975"
"","Strasbourg","France","1949","E8838","Committee of Ministers of the Council of Europe","E","g","#XS1600003074","http://ybio.brillonline.com/s/or/en/1100032758"
"PACE","Strasbourg","France","1949","E8849","Parliamentary Assembly of the Council of Europe","F","g","Parliaments","http://ybio.brillonline.com/s/or/en/1100030576"
"IGCSTD","","","1979","E8866","United Nations Intergovernmental Committee on Science and Technology for Development","U","gd","United Nations Bodies","http://ybio.brillonline.com/s/or/en/1100045364"
"","","","1977","E9612","Ad Hoc Committee on Agreement on Sport","U","gd","#XS1600003074","http://ybio.brillonline.com/s/or/en/1100019388"
"CCPS","","","1957","E9617","Consultative Council for Postal Studies","U","gd","#XS1600003074","http://ybio.brillonline.com/s/or/en/1100014232"
"ECA","Budapest","Hungary","1949","E9634","European Commission on Agriculture","E","g","FAO Bodies","http://ybio.brillonline.com/s/or/en/1100067380"
"FAO/REU","Budapest","Hungary","1947","E9681","FAO Regional Office for Europe and Central Asia","E","gy","FAO Bodies","http://ybio.brillonline.com/s/or/en/1100035037"
"WHO/Europe","Copenhagen","Denmark","1951","E9798","WHO Regional Office for Europe","E","g","WHO Bodies","http://ybio.brillonline.com/s/or/en/1100004299"
"IMC","","","1980","E9955","International Meat Council","U","dg","#XS1600003074","http://ybio.brillonline.com/s/or/en/1100023284"
"ADB","Abidjan","Côte d'Ivoire","1963","F0018","African Development Bank","F","g","Banks","http://ybio.brillonline.com/s/or/en/1100032429"
"TV5","Paris","France","1984","F0037","TV5Monde","F","g","#XS1600003074","http://ybio.brillonline.com/s/or/en/1100011346"
"ADB","Manila","Philippines","1966","F0077","Asian Development Bank","F","g","Banks","http://ybio.brillonline.com/s/or/en/1100054117"
"ADB Group","Abidjan","Côte d'Ivoire","1964","F0121","African Development Bank Group","F","g","#XS1600003074","http://ybio.brillonline.com/s/or/en/1100033535"
"BIS","Basel","Switzerland","1930","F0184","Bank for International Settlements","F","g","Banks","http://ybio.brillonline.com/s/or/en/1100065040"
"","Brussels","Belgium","1985","F0279","EUREKA Organization","F","g","European Union Bodies","http://ybio.brillonline.com/s/or/en/1100031652"
"IIC","Washington DC","USA","1986","F0291","Inter-American Investment Corporation","F","ge","Corporations, Companies","http://ybio.brillonline.com/s/or/en/1100049696"
"","Amsterdam","Netherlands","1969","F0301","Sanquin Bank of Frozen Blood","F","g","#XS1600003074","http://ybio.brillonline.com/s/or/en/1100049695"
"UNIFEM","","","1976","F0308","United Nations Development Fund for Women","U","gfd","United Nations Bodies","http://ybio.brillonline.com/s/or/en/1100056353"
"UNEP/CMS","Bonn","Germany","NA","F0407","Secretariat of the Convention on the Conservation of Migratory Species of Wild Animals","E","g","Treaties","http://ybio.brillonline.com/s/or/en/1100020533"
"","Strasbourg","France","1959","F0438","European Court of Human Rights","F","g","Human Rights Organizations","http://ybio.brillonline.com/s/or/en/1100033558"
"CEB","Paris","France","1956","F0445","Council of Europe Development Bank","F","g","Banks","http://ybio.brillonline.com/s/or/en/1100018218"
"INISTE","","","1984","F0513","International Network for Information in Science and Technology Education","H","gyd","International Federations","http://ybio.brillonline.com/s/or/en/1100063404"
"","","","1971","F0523","Berne Club","U","gx","Clubs","http://ybio.brillonline.com/s/or/en/1100027196"
"COMETT","","","1986","F0534","Community Programme in Education and Training for Technology","U","gd","European Union Bodies","http://ybio.brillonline.com/s/or/en/1100022851"
"COSINE","","","1985","F0695","Cooperation for Open Systems Interconnection Networking in Europe","U","gd","#XS1600003074","http://ybio.brillonline.com/s/or/en/1100023451"
"","Buenos Aires","Argentina","1959","F0711","Antarctic Treaty","F","g","Treaties","http://ybio.brillonline.com/s/or/en/1100000739"
"EMEP","Geneva","Switzerland","1979","F0831","Cooperative Programme for Monitoring and Evaluation of the Long-range Transmission of Air Pollutants in Europe","F","g","#XS1600003074","http://ybio.brillonline.com/s/or/en/1100059321"
"","Haywards Heath","UK","1983","F0850","IMPACT - International Initiative Against Avoidable Disablement","F","g","#XS1600003074","http://ybio.brillonline.com/s/or/en/1100053689"
"","Brussels","Belgium","1985","F0861","Group of Schengen","F","g","#XS1600003074","http://ybio.brillonline.com/s/or/en/1100034907"
"EURIMAGES","Strasbourg","France","1988","F0932","European Support Fund for the Co-Production and Distribution of Creative Cinematographic and Audiovisual Works","F","gf","#XS1600003057#XS1600003074","http://ybio.brillonline.com/s/or/en/1100065105"
"OSCE","Vienna","Austria","1975","F0947","Organization for Security and Cooperation in Europe","F","g","#XS1600003074","http://ybio.brillonline.com/s/or/en/1100016047"
"","","","1976","F0982","European Network of Biogenetic Reserves","U","gd","#XS1600003074","http://ybio.brillonline.com/s/or/en/1100008691"
"GATT","","","1948","F0985","General Agreement on Tariffs and Trade","H","dg","United Nations Bodies","http://ybio.brillonline.com/s/or/en/1100067779"
"G-10","","","1962","F1004","Group of Ten","H","gd","#XS1600003074","http://ybio.brillonline.com/s/or/en/1100047684"
"IDB","Washington DC","USA","1959","F1069","Inter-American Development Bank","F","g","Banks","http://ybio.brillonline.com/s/or/en/1100040548"
"MIGA","Washington DC","USA","1988","F1090","Multilateral Investment Guarantee Agency","F","g","United Nations Bodies","http://ybio.brillonline.com/s/or/en/1100043395"
"","","","1986","F1129","International Neology and Terminology Network","U","gd","#XS1600003074","http://ybio.brillonline.com/s/or/en/1100000323"
"","","","1989","F1177","Euroenviron","H","gd","European Union Bodies","http://ybio.brillonline.com/s/or/en/1100054245"
"UNGOMAP","","","1988","F1241","United Nations Good Offices Mission in Afghanistan and Pakistan","U","gd","United Nations Bodies","http://ybio.brillonline.com/s/or/en/1100056037"
"IBRD","Washington DC","USA","1945","F1393","International Bank for Reconstruction and Development","F","g","United Nations Bodies","http://ybio.brillonline.com/s/or/en/1100034299"
"EUR-OPA Major Hazards Agreement","Strasbourg","France","1987","F1447","Open Partial Agreement on the Prevention of, Protection against and Organization of Relief in Major Natural and Technological Disasters","F","g","Treaties","http://ybio.brillonline.com/s/or/en/1100013790"
"G-24","","","1989","F1492","Group of Twenty Four","H","gx","Humanitarian Organizations","http://ybio.brillonline.com/s/or/en/1100006787"
"","Strasbourg","France","1991","F1527","Partial Agreement on Youth Mobility Through the Youth Card","F","g","Treaties","http://ybio.brillonline.com/s/or/en/1100050200"
"Sommet de la Francophonie","Paris","France","1986","F1536","Conférence au sommet des chefs d'Etat et de gouvernement des pays ayant le français en partage","F","gc","Conference Series","http://ybio.brillonline.com/s/or/en/1100008520"
"BIEF","","","1986","F1567","Banque internationale d'information sur les Etats francophones","U","gd","#XS1600003074","http://ybio.brillonline.com/s/or/en/1100024691"
"","","","1990","F1682","Gulf Crisis Group Financial Coordination","U","gd","#XS1600003074","http://ybio.brillonline.com/s/or/en/1100022321"
"IFAD","Rome","Italy","NA","F1721","International Fund for Agricultural Development","F","gf","United Nations Bodies","http://ybio.brillonline.com/s/or/en/1100017213"
"NFAP","","","1985","F1787","National Forest Action Programme","U","gd","FAO Bodies","http://ybio.brillonline.com/s/or/en/1100050581"
"AFIC","","","1989","F1811","Asian Finance and Investment Corporation","H","ged","Corporations, Companies","http://ybio.brillonline.com/s/or/en/1100040498"
"EPO","","","1978","F1946","Earthnet Programme Office","U","gd","#XS1600003074","http://ybio.brillonline.com/s/or/en/1100059965"
"","New York NY","USA","1982","F1980","United Nations Disarmament Information Programme","F","g","United Nations Bodies","http://ybio.brillonline.com/s/or/en/1100057940"
"","","","1981","F2000","Inter-American Development Bank Administrative Tribunal","U","gx","Staff Associations","http://ybio.brillonline.com/s/or/en/1100054183"
"EURONET DIANE","","","1975","F2054","European Network for Scientific and Technical Information","U","dg","#XS1600003074","http://ybio.brillonline.com/s/or/en/1100023144"
"IFC","Washington DC","USA","1956","F2057","International Finance Corporation","F","ge","United Nations Bodies","http://ybio.brillonline.com/s/or/en/1100041215"
"IMF","Washington DC","USA","1944","F2266","International Monetary Fund","F","gf","United Nations Bodies","http://ybio.brillonline.com/s/or/en/1100010463"
"OSCE PA","Copenhagen","Denmark","1991","F2317","Parliamentary Assembly of the Organization for Security and Cooperation in Europe","F","g","Parliaments","http://ybio.brillonline.com/s/or/en/1100038382"
"GEF","Washington DC","USA","1991","F2335","Global Environment Facility","F","gf","#XS1600003074","http://ybio.brillonline.com/s/or/en/1100028461"
