"io_acronym","io_city_hq","io_country_hq","io_founded","io_id","io_name","io_type_I","io_type_II","io_type_III","io_yearbook_url"
"EUROfusion","Garching","Germany","2014","J8839","European Consortium for the Development of Fusion Energy","E","g","#XS1600003074","http://ybio.brillonline.com/s/or/en/1122277793"
"WCCJ","Strasbourg","France","NA","J9010","World Conference on Constitutional Justice","E","gc","Conference Series","http://ybio.brillonline.com/s/or/en/1122277867"
"GFDRR","Washington DC","USA","2006","J9477","Global Facility for Disaster Reduction and Recovery","F","g","#XS1600003074","http://ybio.brillonline.com/s/or/en/1122278279"
"DeLoG","Bonn","Germany","2006","J9645","Development Partners Network on Decentralisation and Local Governance","F","g","","http://ybio.brillonline.com/s/or/en/1122278305"
"AIIB","Beijing","China","NA","J9944","Asian Infrastructure Investment Bank","F","g","","http://ybio.brillonline.com/s/or/en/1122278643"
"ENIC","Strasbourg","France","1980","K0099","European Network of National Information Centres on Academic Recognition and Mobility","E","g","#XS1600003074","http://ybio.brillonline.com/s/or/en/1100034943"
"THERMIE Programme","","","1990","K0156","Energy Technology for Our Environment","U","gd","European Union Bodies","http://ybio.brillonline.com/s/or/en/1100032030"
"CIP","","","NA","K0212","Comité international de préparation du Sommet francophone","U","gd","#XS1600003074","http://ybio.brillonline.com/s/or/en/1100032073"
"","Strasbourg","France","1987","K0267","European Committee for the Prevention of Torture and Inhuman or Degrading Treatment or Punishment","E","g","Humanitarian Organizations","http://ybio.brillonline.com/s/or/en/1100018609"
"","","","NA","K0404","Ad Hoc Committee of Experts on the Legal Aspects of Territorial Asylum, Refugees and Stateless Persons","U","gyd","International Federations","http://ybio.brillonline.com/s/or/en/1100013738"
"","Bonn","Germany","NA","K0454","European Committee for Postal Regulation","K","g","#XS1600003074","http://ybio.brillonline.com/s/or/en/1100060771"
"CFS","Rome","Italy","1974","K0546","Committee on World Food Security","K","g","FAO Bodies","http://ybio.brillonline.com/s/or/en/1100025894"
"NAM","New York NY","USA","1961","K0563","Non-Aligned Movement","F","g","#XS1600003074","http://ybio.brillonline.com/s/or/en/1100064161"
"EURES","Brussels","Belgium","1994","K0686","European Employment Services","K","g","European Union Bodies","http://ybio.brillonline.com/s/or/en/1100003825"
"DLCC","","","1955","K0863","FAO Desert Locust Control Committee","U","gx","FAO Bodies","http://ybio.brillonline.com/s/or/en/1100031242"
"EAAP","","","1992","K0912","European Alcohol Action Plan","U","gd","WHO Bodies","http://ybio.brillonline.com/s/or/en/1100012206"
"POC","Berne","Switzerland","1994","K1229","Postal Operations Council","K","g","#XS1600003074","http://ybio.brillonline.com/s/or/en/1100012179"
"","Wageningen","Netherlands","1985","K1259","FRIEND/Northern European","K","g","#XS1600003074","http://ybio.brillonline.com/s/or/en/1100061403"
"Ozone Secretariat","Nairobi","Kenya","1989","K1276","Secretariat for the Vienna Convention for the Protection of the Ozone Layer and the Montreal Protocol on Substances that Deplete the Ozone Layer","E","g","Treaties","http://ybio.brillonline.com/s/or/en/1100052097"
"PEBLDS","","","1996","K1302","Council for the Pan-European Biological and Landscape Diversity Strategy","H","gyd","International Federations","http://ybio.brillonline.com/s/or/en/1100030829"
"IMHE","Paris","France","1969","K1345","OECD Higher Education Programme","F","g","#XS1600003074","http://ybio.brillonline.com/s/or/en/1100039659"
"","The Hague","Netherlands","1997","K1411","Conference of States Parties of the Organization for the Prohibition of Chemical Weapons","K","gc","Conference Series","http://ybio.brillonline.com/s/or/en/1100006960"
"IGC","Geneva","Switzerland","NA","K1474","Inter-Governmental Consultations on Migration, Asylum and Refugees","K","gy","United Nations Bodies","http://ybio.brillonline.com/s/or/en/1100047966"
"","","","1994","K1539","Telematics for the Environment","U","gd","European Union Bodies","http://ybio.brillonline.com/s/or/en/1100017994"
"","","","1994","K1544","Multidisciplinary Group on Corruption","U","gyd","International Federations","http://ybio.brillonline.com/s/or/en/1100059590"
"UN/CEFACT","Geneva","Switzerland","1997","K1552","Centre for Trade Facilitation and Electronic Business","K","g","#XS1600003074","http://ybio.brillonline.com/s/or/en/1100003978"
"","","","1976","K1553","EFTA Industrial Development Fund for Portugal","U","gdf","#XS1600003057#XS1600003074","http://ybio.brillonline.com/s/or/en/1100028025"
"UNFCCC Climate Change Secretariat","Bonn","Germany","1995","K1561","United Nations Framework Convention on Climate Change - Secretariat","E","g","United Nations Bodies","http://ybio.brillonline.com/s/or/en/1100014840"
"STRA-REP","","","1997","K1569","Committee for the Development of the Pan-European Ecological Network","U","gyd","UNESCO Bodies","http://ybio.brillonline.com/s/or/en/1100060862"
"","","","NA","K1706","Intergovernmental Negotiating Committee on Persistent Organic Pollutants","U","gd","#XS1600003074","http://ybio.brillonline.com/s/or/en/1100045314"
"CAHDI","Strasbourg","France","1992","K1837","Committee of Legal Advisers on Public International Law","E","gy","International Federations","http://ybio.brillonline.com/s/or/en/1100032426"
"CDDECS","Strasbourg","France","NA","K1855","European Committee on Social Cohesion, Human Dignity and Equality","E","gy","International Federations","http://ybio.brillonline.com/s/or/en/1100014998"
"","Strasbourg","France","1989","K1913","Emerald Network","K","gy","International Federations","http://ybio.brillonline.com/s/or/en/1100004431"
"IPTF","","","1995","K1930","International Police Task Force","U","gd","#XS1600003074","http://ybio.brillonline.com/s/or/en/1100053540"
"UNESCO-UNEVOC","Bonn","Germany","2000","K1984","UNESCO International Centre for Technical and Vocational Education and Training","K","g","UNESCO Bodies","http://ybio.brillonline.com/s/or/en/1100007039"
"ECC","Maisons-Alfort","France","2001","K2142","Electronic Communications Committee","K","g","#XS1600003074","http://ybio.brillonline.com/s/or/en/1100033230"
"TESTA","","","1996","K2181","Trans-European Services for Telematics between Administrations","U","gd","#XS1600003074","http://ybio.brillonline.com/s/or/en/1100019978"
"GEO","Geneva","Switzerland","2005","M0470","Group on Earth Observations","F","g","#XS1600003074","http://ybio.brillonline.com/s/or/en/1100016075"
"ACWL","Geneva","Switzerland","2001","M0704","Advisory Centre on WTO Law","E","g","#XS1600003074","http://ybio.brillonline.com/s/or/en/1100019211"
"EUROFIMA","Basel","Switzerland","1956","M1002","EUROFIMA European Company for the Financing of Railroad Rolling Stock","F","ge","Corporations, Companies","http://ybio.brillonline.com/s/or/en/1100000235"
"IICG","","","1978","M1008","Islamic Investment Company of the Gulf","U","ged","Corporations, Companies","http://ybio.brillonline.com/s/or/en/1100024496"
"GCIM","","","2003","M1224","Global Commission on International Migration","U","gd","#XS1600003074","http://ybio.brillonline.com/s/or/en/1100026136"
"UNAOC","New York NY","USA","2005","M1270","United Nations Alliance of Civilizations","E","gy","United Nations Bodies","http://ybio.brillonline.com/s/or/en/1100020080"
"","Tabernas","Spain","NA","M1609","IEA SolarPACES","K","g","#XS1600003074","http://ybio.brillonline.com/s/or/en/1100060104"
"BALTSEA","","","1997","M1943","Baltic Security Assistance Forum","U","gd","#XS1600003074","http://ybio.brillonline.com/s/or/en/1100025510"
"","Toronto ON","Canada","1995","M2427","Egmont Group of Financial Intelligence Units","F","g","#XS1600003074","http://ybio.brillonline.com/s/or/en/1100060120"
"MOPAN","Helsinki","Finland","2002","M2509","Multilateral Organizations Performance Assessment Network","F","g","#XS1600003074","http://ybio.brillonline.com/s/or/en/1100058503"
"MINUSTAH","New York NY","USA","2004","M2544","United Nations Stabilization Mission in Haiti","F","g","United Nations Bodies","http://ybio.brillonline.com/s/or/en/1100015620"
"FCPF","Washington DC","USA","NA","M3196","Forest Carbon Partnership Facility","F","gy","International Federations","http://ybio.brillonline.com/s/or/en/1100002492"
"EPAS","Strasbourg","France","2007","M3416","Enlarged Partial Agreement on Sport","F","gy","International Federations","http://ybio.brillonline.com/s/or/en/1100021132"
"IRKA","Masein","Switzerland","1995","M3417","Internationale Regierungskommission Alpenrhein","D","g","#XS1600003074","http://ybio.brillonline.com/s/or/en/1100022062"
"APF","Washington DC","USA","2003","M3547","Africa Partnership Forum","E","gy","International Federations","http://ybio.brillonline.com/s/or/en/1100038036"
"IFC","Basel","Switzerland","1995","M3584","Irving Fisher Committee on Central Bank Statistics","E","gy","International Federations","http://ybio.brillonline.com/s/or/en/1100027728"
"RCC","Sarajevo","Bosnia-Herzegovina","2008","M3681","Regional Cooperation Council","F","gy","International Federations","http://ybio.brillonline.com/s/or/en/1100006835"
"IEF","Riyadh","Saudi Arabia","NA","M3690","International Energy Forum","F","g","#XS1600003074","http://ybio.brillonline.com/s/or/en/1100064053"
"GIF","Issy-les-Moulineaux","France","2001","M3758","Generation IV International Forum","F","gy","International Federations","http://ybio.brillonline.com/s/or/en/1100063322"
"","Strasbourg","France","NA","M4295","Enlarged Partial Agreement on Cultural Routes","F","g","","http://ybio.brillonline.com/s/or/en/1122278932"
"NA","NA","NA","2007","T0700","Council of Europe Convention on the Protection of Children against Sexual Exploitation and Sexual Abuse","T","g","Treaties, IGOs","http://ybio.brillonline.com/s/or/en/1122278948"
"CCM","London","UK","2008","T1808","Convention on Cluster Munitions","T","g","Treaties, IGOs","http://ybio.brillonline.com/s/or/en/1100017674"
"Geneva conventions","Geneva","NA","1949","T4926","1949 Four Geneva Conventions","T","g","Treaties, IGOs","http://ybio.brillonline.com/s/or/en/1100024170"
"CITES","Geneva","Switzerland","1973","T7392","Convention on International Trade in Endangered Species of Wild Fauna and Flora","T","g","Treaties, IGOs","http://ybio.brillonline.com/s/or/en/1100018276"
"GPA","NA","NA","1979","T7902","Agreement on Government Procurement","T","g","Treaties, IGOs","http://ybio.brillonline.com/s/or/en/1100058490"
"ARB","","","1952","U8710","Air Research Bureau","U","gd","#XS1600003074","http://ybio.brillonline.com/s/or/en/1100049364"
